Content,Date,User
"Sí, también misóginos y arribistas.",30 ago.,@laishawilkins
No puedo entender como “hombres” que se presumen inteligentes y autónomos puedan ser tan sumisos y abyectos ante un “rey”. Pero me acuerdo del papel de los bufones y se me pasa ese sabor a caca en la boca cuando veo esto.,30 ago.,@serabenh
Comunista de ultra derecha,29 ago.,@MACNASRUDIN
"Gran presidente apoyo total a nuestro presidente, viva nuestro presidente 🇲🇽❤️💪🏻.",30 ago.,@ArmandoZermeno2
"Con la panzota que se carga ??? No mame , no es creíble que haga usted ejercicio.",31 ago.,@gerryboy10
"La transformación va!!!!!! Pero a chinga a su madre a la basura!!!! No es posible que se den preferencia de recursos a sus elefantes blancos y no a salud y otros sectores con prioridad y prefiera atolear a sus mascotas con la venta de sus cachitos, pinche mitómano!!!!",31 ago.,@Ricardo99899469
Porque no haces el ejercicio de ir a chingar a tu madre y dejas que resolvamos esto sin ti y las lacras de tu partido. Asesino.,31 ago.,@ajusta1978
Puro cromasables 😂😂😂😂...,30 ago.,@ernestolizarra5
"Los comentócratas e intelectuales orgánicos del viejo régimen se pusieron celosos; quieren su foto. 

A ellos les citaban en Los Pinos a escondidas 🙊",30 ago.,@CitlaHM
"ERES UN PERVERSO HIPOCRITA PSICOPATA

TE HAS DEDICADO A DESTRUIR AL PAÍS PARA SOJUZGARNOS MAS FACIL 

PERO LO PEOR ES LA MASACRE QUE ESTAS HACIENDO CON LOS MAS POBRES Y ENFERMOS

EN ESPECIAL ASESINAR NIÑOS INOCENTES QUE SUFREN CANCER 

SERAS JUZGADO POR GENOCIDA

@OficialFrenaaa",30 ago.,@Oscarsvm1
Mmm😠😠😠 tu cul@.. que enojada de escuchar tanta barbaríe,30 ago.,@empanadajodona
¿Y si en lugar de andar de guía de turistas aprovechas el tiempo y te vas al psiquiatra a ver que chingados puede hacer con tu locura? Te lo agradeceríamos mucho mucho.,30 ago.,@imongom
Pasaron por su chayote?,30 ago.,@ESilmarillion
"¡Ay mi Presidente, su carita, ya se ve cansado!  😢",31 ago.,@anavibibi
"Póngase a trabajar, viejo pndjo.",30 ago.,@mexicocontodos
"Andrés Manuel, nos vendría bien que ejercitaras la transparencia, la rendición de cuentas, la honestidad, la decencia, la honradez y la sensatez.",30 ago.,@aracelibs
Puro chingon!!,30 ago.,@rn_montesinos
Puro pendejo como tu,30 ago.,@LaMorenaLoca88
"Y tenemos al mejor Presidente.
#AMLOFortalezaDeMéxico",31 ago.,@FilipoOcadiz
"Mi presi es un gran ejemplo ♥️
lo respeto mucho ♥️",31 ago.,@EdiBAMLOver
"He aquí al que iba para las ligas Mayores para ser un Babe Ruth pero se chingó la rodilla, he aquí al que prometío ser un Estadista al nivel de Merkel pero por culpa de los neoliberales dice no poder resolver nada.",30 ago.,@HoracioLuki
"Que cinismo, en este sexenio como en ningún otro hay adjudicaciones directas, falta ver la que le dieron al compadre de Rocío Nahle.",30 ago.,@MariettoPonce
Mejor ve y plática con los padres de los niños con cáncer o con los familiares de los muertos por covid o por lo menos visita hospitales ahí te demostrarán lo poco inteligente que eres y te lo dirán con sentido del humor para que no te amargues,30 ago.,@DuranCuitlahuac
Perfecto. Entendido: Gracias por debidamente identificar a tus lambehuevos.,30 ago.,@mmsoriano
Que onda con su look de Fidel?,30 ago.,@jdanielgguar
"México es el TERCER lugar en muertes por covid en el Mundo, eso es bienestar?????
#AmloElFracasoPresidencial #COVIDー19 #",31 ago.,@pris_guayaba
El payaso de Palacio Nacional!,30 ago.,@MarcoValor10
"Jajajajajajajjaja oilo, jajajajajjajajaja
#AmloCorruptoMafioso
#lopezCORRUPTO",29 ago.,@oagarcial2
Muy bien Presidente es usted un roble y un gran ejemplo para nosotros. 👏👏👏,30 ago.,@EmmaChoquita
"Que le avise su srio de hacienda al mitómano,  que su gobierno se comienza a quedar sin dinero para sus obras faraónicas y sus programas de dádivas; la realidad muy pronto alcanzará al falsario, y sus malas decisiones todos lo pagaremos a un precio muy alto.",30 ago.,@ernest_kings
"Pinche viejo, como no le dio el tamafaz y se quedó allá en el monte q se lo comieran los zopilotes",31 ago.,@mito_rios
"Hay luchadores que tienen su versión mini, Octagoncito, Mascarita Sagrada, Espectrito... 

Usted, Andrés™, es la de Calderón. 🙊",29 ago.,@RepDeFiFidonia
Se nota!!! 😤😤😤Ya te acabaste hasta las reservas...,31 ago.,@valentinaII
Esos si son moneros y no pendejos resentidos como @CartonCalderon 😂😂😂😂😂😂😂😂😂😂,30 ago.,@capitangato69
El Cacas Fit...,31 ago.,@gatoguitarrista
"Sacando raja política de todo.... hasta de los muertos

Mientras tanto, el país cayéndose a pedazos",31 ago.,@BubulinJr
"Andy ""Marca Registrada"" Lupus, vengo del futuro.

11 años después, sigues cumpliendo tu palabra, sin fallas.",31 ago.,@PacooGarcia
"@lopezobrador_  "" los idóneos en el olvido"" @emoctezumab ""fuimos evaluados como nunca"" hoy no tenemos basificación, desde 2014, 2015 esperando la oportunidad de superación! <Maestros de calidad> queremos basificacion para la superación docente. Uemstis y dependencias Morelos!!",31 ago.,@PatriciaAragn6
"Usted es un ser de luz querido presidente. 
Las mejores bendiciones siempre para usted 🙌

#EsUnHonorEstarConObrador ❤🇲🇽",31 ago.,@KyadiraBJ1
Y eso como para en que año lo va a empezar a implementar? #KarmaMamut 🤭,31 ago.,@GuereroJaguar
"Cómo te encanta hacerte pndejo.
Dices haber subido un cerro sin tener una gota de sudor, no hay una sola palabra que salga de tu boca que sea verdad, mientes como respiras.
Eres la personificación del fracaso, presidentito inepto.",31 ago.,@OsvaldoLuciotto
El Narco Estado lo encabezas tú!!!!!,31 ago.,@Alex_Sada1
"64,158 x 3.05 defunciones

64,158 x 3.05 defunciones

64,158 x 3.05 defunciones

64,158 x 3.05 defunciones

64,158 x 3.05 defunciones

64,158 x 3.05 defunciones

64,158 x 3.05 defunciones

64,158 x 3.05 muerte

=195,682 defunciones 

RENUNCIEN HOMICIDAS 
@lopezobrador_ @HLGatell",31 ago.,@elmuyasi
"Siguen los hospitales del @Tu_IMSS e @ISSSTE_mx sin medicamentos para TODOS los padecimientos !
- Ya es hora de surtir !",30 ago.,@Thomastlahuac
"Le haría bien ejercitar el cerebro don López, nos iría bien a todos",30 ago.,@donosolara27
"Qué bonito es turisteár mientras hay muchas familias sufriendo por falta de tratamiéntos médicos,familiares desaparecidos,desempleadoa y tú  perdiendo el tiempo.
Inépto!
He vivido en México desde Lopez Mateos hasta hoy y no me equivoco al decir que eres el más incompeténte.",30 ago.,@ManuelM57022300
N abrazo para Saludos usted y su familia querido Señor Pdte @lopezobrador_ 🤗,30 ago.,@johnerencastle
"Si muy bonito y todo pero lo votaron para TRABAJAR y dar resultados. Bienestar no es desempleo, desabasto de tratamientos, medicinas, ni inseguridad, mucho menos ocultar la verdadera crisis COVID.",30 ago.,@RiosCorona1
"Comparte la imagen del Zócalo. Hacer ejercicio, mejor dicho a huir de la voz que exige tu renuncia!",30 ago.,@josemarmed
"Fe de erratas. Donde dice: “amigos”, debe decir: “lambiscones”.",30 ago.,@rodsainz1
Qué interesante.....ya me dio sueño.,30 ago.,@Mexicano100PC
"Amigos radicales de Izquierda,

Se acuerdan que critican a Ciro o Loret por salir en fotos con políticos de derecha?  

Bueno ahí tienen a sus chayoteros. ¿Sus opiniones si cuentan?

😂😂😂✍️🧐",30 ago.,@DonPorfifirio
"El tráfico de influencias en esta administración es la más descarada en décadas que afecta todos los poderes de la federación  eliminando su autonomía, tanto así que a pesar de la baja transparencia se ha dejado ver la corrupción y compadrazgo. 
La ley esta en segundo plano.",29 ago.,@cosgaya_emilio
"Se predica con el ejemplo pequeño bufón de palacio.
Porqué asignár contratos sin licitación a algunos empresarios?
De a como es el ""móche""?",29 ago.,@ManuelM57022300
Ni hablar sabe.,31 ago.,@RGermenos
Seguro oh mesías incandecenre y por ñaque no lo haces pendejo,31 ago.,@LuisArc97891750
"Puras palabras al aire, MÉXICO TE QUEDA MUY MUY GRANDE, corrupto! FUERA LÓPEZ!",31 ago.,@josemarmed
"Explícanos cómo le vas a hacer si solo estas espantando la inversión privada nacional y la extranjera ni que decir,nos estas llevando a un pozo sin fondo en todo:salud de terror,economía de pesadilla,división entre mexicanos a todo lo que da,eres un destructor!TRAIDOR A LA PATRIA",30 ago.,@JorgeAguilarC81
Estás demente López. Por el bien de todos realízate estudios.,30 ago.,@riaton_don
"Viejito, el día que aceptes que la haz cagado en muchas cosas y busques reconciliación con el sector privado y los emprendedores, ese dia quizá se pueda mejorar la situación, mientras sigas con tu melagomanía nos seguirá cargando la chingada..",30 ago.,@alextrancevibe
"Visité el H. Colegio Militar recién terminado el conjunto (era yo un bebé de una semana, je, je) y esos cerros estaban muy pelones. Ahora se ve un bosque muy avanzado.",30 ago.,@feliciano1953
"Es un honor estar con Obrador. 🇲🇽
Y una diversión ver cómo explotan de rabia los fanáticos de Calderón.",30 ago.,@ElReyTuitero
"😂😂😂😂😂😂😂😂😂😂😂😂😂

Ridículo! 

Todos los de contratos directos amigos o familiares de funcionarismos te mandan saludos!✍️🧐",30 ago.,@DonPorfifirio
"63,000 muertos.
12 millones de personas que pierden fuente de ingresos.
Pérdidas históricas de Pemex.
Incremento imparable de feminicidios.
Niños con Cáncer sin tratamiento desde hace meses.
Recesión económica desde el inicio del gobierno actual.
Incremento en la inseguridad.",29 ago.,@alexsoldela
"Cínicamente,  así nada más",29 ago.,@CeltaMexa
"Mensaje enviado a todas las mascotas del imperio que se traduce: Si se mueren por covid o de hambre no se preocupen, ustedes son el ejemplo de austeridad republicana y serán recordados como héroes de la 4T. Vaya cinismo.",29 ago.,@luisfergarcia
"@lopezobrador_ Una pregunta ¿Economía moral 
es dejar sin tratamiento médico a los niños enfermos de cáncer?",29 ago.,@LuisArm28147370
"Eres un insulto para los mexicanos.
No tienes con que sacar a México de esta situación 
#AmloCorruptoMafioso",29 ago.,@paquitodom
"#ElMentirosoMasGrandeDelMundo es patètico presumiendo remesas y apoyos que no existen, mèxico es de los países que menos a ayudado a sus ciudadanos ante la pandemia.",29 ago.,@IJ0ACHIM
"-Estamos ayudando con ¡Créditos, Pensiones, Becas!-
  Créditos de $25 mil (que a nadie interesaron)Becas de $ 3,000 que se toman en una noche.
 Que poco quiere para los Mexicanos este Pelele.
Piensa que todos nos conformamos con la comoda mediocridad de sus Chairos.",29 ago.,@cuattro1968
"Nunca creí que usted fuera una amenaza para Mexico, pero en estos años confirmó que si lo era, incapacidad, ineptitud, corrupción, inseguridad, fuga de inversiones, ingobernabilidad, todo lo ha logrado y sin ayuda.",30 ago.,@enherguz
Empleo bienestar....y aportaciones voluntarias,30 ago.,@cebarilla
"Cuidese mucho Presidente por que aún le falta otro sexenio con nosotros, lo vamos a reelegir. 🥰😉",30 ago.,@Brenn0505
"Padres de niños brutalmente asesinados (LeBaron), o secuestrados (Sicilia), o de niños con cáncer, le insisten a López reunirse con ellos para atenderlos. El presidentito prefiere recibir a caricaturistas para abiertamente mostrar que le URGE su apoyo al perder popularidad 😡😡😡",30 ago.,@RexMarin
Puro mugroso resentido,30 ago.,@MonomitoMex
Espero que esos monederos hagan una caricatura sobre un grupo de personas de población vulnerable que no se cuidan que no usan cubrebocas ni siguen las medidas de sana distancia,30 ago.,@ISROAGM
"64 mil fallecidos por COVID, niños muriendo de cáncer por falta de medicamento, millones de empleos perdidos, familias sin dinero ni para comer

Y tu atendiendo a payasitos con ""sentido del humor""

Estas disfrutando tanto el poder, que no te das cuenta que lo pierdes rapidamente",30 ago.,@DTigreregio
"Gracias Presidente Licenciado Andrés Manuel López Obrador, yo estoy con Usted y no con los corruptos que dejaron el país en bancarrota y ahora envían sus mensajes como si antes el país hubiera sido un paraíso, cuánto les duele ya no poder robar.
Yo 💯 AMLO.",29 ago.,@Blanch36175684
"En su mundo paralelo eso es un triunfo, es obvio que no es economista ni entiende ni papa de finanzas! Quien fregados lo asesora don MALO?",29 ago.,@Arita12198321
"No @lopezobrador_  contigo jamás Mexico saldrá adelante nos estás llevando al precipicio, este es el peor sexenio de la historia! #AmloCinicoTraidor #ElPeorPresidenteDeLaHistoria",29 ago.,@KalEl7612
"El pueblo de México tal vez, pero usted es un papanatas.",29 ago.,@abe160892
"Eres un inepto presidente, llevas 19% negativo el PIB y prometiste crecer al 6% y llevas mas de 100 mil muertos por covid",28 ago.,@GusEspejel
¿En qué cantina anduvo el presidentito @lopezobrador_ el día de hoy?,30 ago.,@MuertosDelPeje
"Eres empresario de la corrupción López y narco presidente.
#lopezCORRUPTO
#LOPEZcriminalconfeso",29 ago.,@RTizador
"Lastima de inepto presidente, para tan bonito país q es México.",29 ago.,@NayeNoguera
"Las pensiones, prestamos y becas salen de los que, con mucho esfuerzo, pagamos nuestros impuestos a pedar de su desastre! Usted lo único que hace es repartir o despilfarrar a conveniencia y de forma procelitista. De nada!!!",29 ago.,@CallFifi
"Por fin tienes razón en algo: NO ES PARA PRESUMIR.

Las remesas no son logros, las dádivas ayudan de manera efímera y no producen riqueza de vuelta, efectivamente no tienes nada que presumir.
Por cierto, los fríos números dicen que tu gobierno es el peor en el peor momento.",28 ago.,@OsvaldoLuciotto
"Jajajajajajajajajajajajajajajajajajajajajajajajajajajajajajajajajajajajajajajajajajajaja. 
Palabras más palabras menos los que están “salvando” a México son los paisanos que viven en EUA. NO TÚ, para variar @lopezobrador_ no dejarás de ser un vividor acomplejado.",28 ago.,@isco9981
La grandeza de mexico y su presidente.,28 ago.,@forozcolg
"Una vez más, las remesas NO, repito NO son un logro de gobierno, la crisis económica si es un logro tuyo, sin dudas y el mal manejo de la crisis sanitaria.... es compartido entre tú y @HLGatoell .... el mejor gobierno fue el de Don @FelipeCalderon ... por su atención gracias",28 ago.,@DiabloMayor14
Dos crisis AUTOINFLIGIDAS por el CuatroTe,28 ago.,@MauricioLlergo
"Efectivamente, el pueblo Mexicano es mucha pieza y tú no estás, ni estarás a la altura.

Deja de mentir , estas llevando al país a situaciones extremas, nunca antes vistas, deja de atacar a todo el mundo y ser clasista.

NO SIRVES COMO PRESIDENTE
NO TE RECONOCEMOS
ERES CORRUPTO",28 ago.,@jequesa
"Sr Lopez, vivimos otra crisis peor que la sanitaria y económica, que es el origen de las que usted comenta.
Esa crisis se llama 4T que es el nombre de su gobierno. 
La única transformación que ha generado su gobierno es la principal crisis del país en la historia de México",28 ago.,@PEPEGOAL
"México enfrenta la peor crísis de su historia, causada por pseudopresidente demente, corrupto e inepto, que al frente de una secta tienen como único objetivo saquear y destruir al país.",28 ago.,@Batman6210
"tienes razón somos mucha pieza, no merecemos a un P3NDEJO, CORRUPTO Y CÍNICO COMO TÚ !!!!!!!",28 ago.,@drakulyadmt
"Sigues tomando como un logro histórico el envío de remesas.
3 pesos de madre.
 gastas dinero de nuestros impuestos a diario con las mañaneras cirqueras, no se necesita un informe.",28 ago.,@Alranda_G1
"México está enfrentando las dos peores crisis en la historia:

1. Andrés Manuel  López Obrador.
2. Gobierno de Morena.",28 ago.,@aracelibs
"No es así señor presidente.
Este gobierno hundió al país en la violencia al pactar con el Cartel Jalisco Nueva generación y Cartel de Sinaloa.
Este es ahora más que nunca, un narco estado en el que la ley está para satisfacer la agenda pública presidencial.",28 ago.,@cosgaya_emilio
"Todo un éxito tu gestión, nada más hay 26 millones de personas sin empleo.

Mejor ya cállate el hocico López.",29 ago.,@OmarIva71061938
"Todo mi apoyo para usted querido presidente.
Ayer hoy, mañana y siempre 
#EsUnHonorEstarConObrador",29 ago.,@ClaoCarlet
"@lopezobrador_  eres un farsante por lo menos ponte traje y corbata aunque eso a ti no te va, el país está en ruinas por tu culpa y el imbecil de @HLGatell  todos los de tu gabinete son unos ineptos! #ElPeorPresidenteDeLaHistoria #EsUnHorrorEstarConObrador",29 ago.,@KalEl7612
Chamarras estilo Fidel... el giro  retro está de moda entre los dictadores bananeros👌,29 ago.,@panzas_sr
"Buen desempeño de la Senadora Mónica Fernández, ¡Felicidades! 

De la Diputada Rojas, sin comentarios.",29 ago.,@resulta_ahora
México es mucho para el presidente tan pequeño y mediocre que tiene,29 ago.,@NoniLoGo
"Por supuesto somos mucha pieza. Las crisis las provocantes tu, con tu ignorancia, corrupción, necedad y caprichos. La peor crisis es este desgobierno de charlatanes, ladrones y asesinos.
Pagaras cada vida terminada, cada familia destruida, cada niño muerto.
#LopezEresUnMiserable",28 ago.,@renebmex
"Entienda que las remesas NO SON LOGRO DE SU GOBIERNO porque es dinero que viene del extranjero!! 🙄 Cambie el discurso. La crisis sanitaria con las de 61 mil muertos, la crisis con económica con desempleo y una caída del PIB q no se había visto el décadas. Se necesitan resultados",28 ago.,@SusanaV61
"¿Pues no decías que no había crisis? Porque el PIB no refleja la verdadera realidad del pueblo y ahora ya hay más bienestar.

Mientes tanto que ya no te acuerdas lo que dices. Corrupto.

Las remesas son un logro de EE. UU. Porque su economía neoliberal sigue funcionando bien.",28 ago.,@Quetzal0518
Las crisis sanitaria y económica son insignificantes comparadas con la crisis de gobierno que sufre México.,28 ago.,@MexMejor
"MENTIROSO, ERES EL MÁS CORRUPTO DE TODOS, EL PEOR!!!",28 ago.,@salzaga
Usted! Si Usted adopta la MENTIRA como un hábito de conducta con el pretexto de ocultar su ineptitud.  NO habla con verdad irremediablemente es de todos los dias. Es un enfermo 🇲🇽 ya lo reconoce como EL MITOMANO del palacio. Promocionales fuera de la realidad,28 ago.,@DergalMaite
"@lopezobrador_ antes de dormir:
Chingas a tu madre pinche viejo resentido huevon vividor.
Según tú, tienes el 70% de aprovacion, MENTIRA, NADIE TE QUIERE.
ESTAS DESPEDIDO!",28 ago.,@BrunoMoralesIs1
"¿Por qué tan desesperado por purificar su imagen, Señor Presimueble?",28 ago.,@neoliberalover
"Puede repetir una mentira 1000 veces y va a seguir siendo mentira. 

Viejo mitomano!✍️🧐",27 ago.,@DonPorfifirio
"@lopezobrador_ has dilapidado nuestros recursos y frenado el desarrollo de México haciendo que los inversionistas pierdan la confianza en México solo para complacer tus absurdos caprichos con tus #EncuestasGansito, se contrajo la economía 18.7 por tus necedades de dictadorsucho!",27 ago.,@lyneth50973592
"Cero corrupción: Bartlett, dr houses, Pío.

Cero impunidad: #LeBaronFamily 

Narcoestado:  Ovidio, la familia del Marro.
La mamá del chapo.

Puras mentiras, se nesecita estár bien Pndej0 para creerle ...

Punto.",27 ago.,@bta_Demian
No permita que Monreal meta las manos en elecciones del senado hoy en la marcha se vio que la gente ya no lo quiere,29 ago.,@fulvia_rut
Presidente @lopezobrador_ los maestros del Programa Nacional de Inglés PRONI necesitamos mucho su apoyo. Hemos solicitado la revisión de nuestras condiciones laborales durante 2 años sin tener respuesta del Secretario @emoctezumab @rigel_deneb @Gio_Proni_NL,29 ago.,@fuerzaprooaxaca
Chinga tu madre,29 ago.,@Daniel62243761
"¡NI TÚ LO CREES!
Tu ineptitud es evidente. No se trata de ""ser mucha pieza"" ¡No seas absurdo! 
Se trata de tener un PLAN DE GOBIERNO congruente y luego una EJECUCIÓN IMPECABLE, pero tú NO ERES el gobernante que México necesita. 
Te queda grandísimo el reto.
#LopezMexicoTeRepudia",29 ago.,@CanallaPerro
"México esta enfrentando 3 crisis:
1.- Andres López Obrador. 
2.- Morena 
3.-Coronavirus.",29 ago.,@Rafael_mex_litu
El peor Presidente en el peor momento.,29 ago.,@Anaro74
"El peor virus es el de la 4t, que se aloja en personas ignorantes y resentidas. Ese es el verdadero peligro para México!",29 ago.,@martiamex
"No es para presumir, da pena.

Los migrantes mandan más recursos por el poco apoyo que recibimos, no es motivo de orgullo, nada que presumir.

El peor momento con el peor gobierno.

Por cierto veo que ud vive ATM rodeado de lujos mientras hay hambre, así es la incongruencia.",28 ago.,@QuiqueVallarino
"El hacer tantos ademanes es una muestra de la desesperación que traes encima, mi estimado costal de pretextos.
Tú y Morena no son crisis, son dos tipos de cáncer que están atacando a México como nunca antes en la historia.",28 ago.,@StarwalkLucifer
"LOS NIÑOS CON CANCER SIGUEN SIN TRATAMIENTOS.

LOS NIÑOS CON CANCER SIGUEN SIN TRATAMIENTOS.

LOS NIÑOS CON CANCER SIGUEN SIN TRATAMIENTOS.

LOS NIÑOS CON CANCER SIGUEN SIN TRATAMIENTOS.

LOS NIÑOS CON CANCER SIGUEN SIN TRATAMIENTOS.",28 ago.,@ISROAGM
"Ordenaste liberar al hijo del Chapo y luego fuiste a visitar a su mamá y abogado.

Ese es NARCOESTADO.",28 ago.,@ponchoherrera
"Cero corrupción? 
Seguramente la vas a patentar como marca registrada de tu familia.
Ya verás cuánta putrefacción saldrá de las acciones de tus operadores y familiares corruptos!",28 ago.,@Raraban
"Don Andrés, le busca Ovidio.",28 ago.,@rtraconis
"El dinero que recibió tu hermano es corrupción, es un  delito del que además aceptaste formar parte.

Y el narcoestado jamás había sido tan claro como ahora",28 ago.,@MariettoPonce
"Jajajajajaja Pinche cinismo cuando en Michoacán están en guerra.

Cuando el gobierno no hace nada para frenar la delincuencia en ese estado. 

No cabe duda que son unos mentirosos e hipócritas. #Exijemexico",27 ago.,@Yojhan54532638
"Q cinismo.  Deja en libertad a Ovidio, come con el Cartel de Sinaloa, el pio gate.  Increíble",27 ago.,@MonomitoMex
"Repugnante Anciano Decrépito y Mitómano 

Fallido Presidente 

Tu eres el títere de un narco estado.  Todo el mundo lo ve.",27 ago.,@XoloElvis
"Si, solos y sin ti nos defendemos mejor.

Muy bien por ti que aceptas en esa declaración que no sirves para nada.

Como si no hubiera  presidente, si, somos mucha pieza para tan enano presidente, por eso salimos adelante solos.",28 ago.,@vaqueronight63
Dicen que Ricardo Monreal quiere el lugar de AMLO croe que es mentira pero. No se,28 ago.,@RalRodr82535915
"Tu eres protector del narco, vivimos en un narco estado porque son tus patrocinadores no te hagas pendejo. Nunca hablas en contra de ellos. Los justificas, los consideras pueblo©️. Hipócrita de porquería.",28 ago.,@DMuffin2020
18 años en campaña no fueron suficientes kks???,28 ago.,@CandyHoneyLiz
Reitero hay un video de tu hermano recibiendo soborno y no lo presentaste en tu circos mañaneros! No he visto que enjuicien al corrupto de Barbosa o que hagas algo por los ventiladores a sobreprecio!! eres la misma mierda de la que tanto te quejas!! #ElCacas #ElCacasCorrupto,28 ago.,@MGuerrero92
Empieza con el ejemplo de verdad estás Demente!!!!! #AMLOelPeorPresidenteDelMundo #AmloCorruptoMafioso,28 ago.,@cyntia38254168
"López Obrador dice que está pacificando al país 🤨
Los homicidios y la delincuencia han roto récords en su sexenio.

Ya no habrá un Garcia Luna en el gobierno, pero si hay puro inútil que ha permitido a la violencia y a la impunidad crecer desenfrenadamente. 
 ¿En qué país vive?",27 ago.,@aracelibs
Queremos a Felipe Calderón en la cárcel cabecita de algodón 🇲🇽♥️,27 ago.,@nayeli786
"@lopezobrador_ no permitas que Eduardo Ramírez presida el Senado lo conocemos en Chiapas y es un corrupto le dará mala imagen a la 4T, estamos contigo pero no permitas esas cosas",27 ago.,@manuel_rojas12
"Estamos contigo, del lado de la honradez.
Queremos juicio a expresidentes.",27 ago.,@hhmarlau
A los únicos que no ha traicionado es los que jamás hemos creído en usted. Está haciéndolo tan mal como lo predijimos.,27 ago.,@EIJefeDiego
"Demasiado tarde, traicionaste la confianza y aceptaste haber cometido un delito, ¿estás pidiendo disculpas? Por que para promesas ya no la hiciste...",27 ago.,@ReginadelC
"¿Humanismo?

¿Cuando por tus caprichos has empobrecido a México y causado miles de muertos?

¡Hipócrita!

¡Sepulcro blanqueado!

¡Vividor!",27 ago.,@HectorSisan
"No será el 30%, sólo el que te apoya?",27 ago.,@Fryre3
"Ya lo hizo señito, no solo la confianza, nuestra nacionalidad, soberanía, paz, economía y la más grave, nuestra salud.",27 ago.,@chaosoda1
"El pueblo necesita conocimiento.  @Conacyt_MX .Rechazada por CONACyt con oferta doctoral en Universidad de Warwick con un proyecto enfocado a la modelación estadística de la demanda hospitalaria de COVID-19. 
@FelipeCalderon @CarlosLoret @hectorslimseade",27 ago.,@CuevasIlse
Ponte a Trabajar Huevón Farsante.,26 ago.,@JONATHA83425585
"#yonosoyel70porciento
Mitomanía -Es un problema al que se le debe prestar atención. Es un trastorno psicológico que consiste en una conducta repetitiva del acto de mentir. Por medio de sus mentiras, el mitómano busca beneficios inmediatos.",26 ago.,@lhestudios
"Ya la traicionaste, corrupto, admitiste cínicamente haber cometido un delito electoral grave.",26 ago.,@MariettoPonce
"Fachos, HDSPM, repitan conmigo:

☑️ El 70% respalda al Pdte López Obrador.

Punto.",26 ago.,@Berexun
"Como es costumbre, al primate resentido no se le dan los números. El desquiciado es @lopezobrador_",26 ago.,@elequipomx
"El 70%....yo diria el 90% estamos felices contigo

El otro 10% son los tipicos tranzas, vividores  PRIANISTAS",26 ago.,@forozcolg
